{
  "id": "vehicle.truck",
  "name": "Flatbed truck",
  "drive": {
    "power": "engine",
    "speed": 8,
    "accel": 3,
    "brake": 6,
    "noise": 36,
    "idle": 6,
    "tank": 80,
    "range": 9000,
    "idleMinutes": 70
  },
  "cab": true,
  "dash": "cluster",
  "footprint": {
    "w": 2,
    "l": 4
  },
  "appearance": {
    "variants": [
      {
        "id": "pale",
        "ns": "vehicle_truck_intact_ns",
        "ew": "vehicle_truck_intact_ew"
      },
      {
        "id": "green",
        "ns": "vehicle_truck_intact_ns",
        "ew": "vehicle_truck_intact_ew"
      },
      {
        "id": "burnt",
        "ns": "vehicle_truck_wreck_ns",
        "ew": "vehicle_truck_wreck_ew"
      }
    ]
  }
}
