{
  "id": "vehicle.van",
  "name": "Panel van",
  "drive": {
    "power": "engine",
    "speed": 9,
    "accel": 3.5,
    "brake": 7,
    "noise": 28,
    "idle": 5,
    "tank": 60,
    "range": 11000,
    "idleMinutes": 80
  },
  "cab": true,
  "dash": "cluster",
  "footprint": {
    "w": 2,
    "l": 4
  },
  "appearance": {
    "variants": [
      {
        "id": "pale",
        "ns": "vehicle_van_intact_ns",
        "ew": "vehicle_van_intact_ew"
      },
      {
        "id": "green",
        "ns": "vehicle_van_intact_ns",
        "ew": "vehicle_van_intact_ew"
      },
      {
        "id": "burnt",
        "ns": "vehicle_van_wreck_ns",
        "ew": "vehicle_van_wreck_ew"
      }
    ]
  }
}
