{
  "id": "vehicle.sedan",
  "name": "Sedan",
  "drive": {
    "power": "engine",
    "speed": 10,
    "accel": 4,
    "brake": 8,
    "noise": 24,
    "idle": 4,
    "tank": 40,
    "range": 12000,
    "idleMinutes": 90
  },
  "cab": true,
  "dash": "cluster",
  "footprint": {
    "w": 2,
    "l": 3
  },
  "appearance": {
    "variants": [
      {
        "id": "pale",
        "ns": "vehicle_sedan_intact_ns",
        "ew": "vehicle_sedan_intact_ew"
      },
      {
        "id": "green",
        "ns": "vehicle_sedan_intact_ns",
        "ew": "vehicle_sedan_intact_ew"
      },
      {
        "id": "burnt",
        "ns": "vehicle_sedan_wreck_ns",
        "ew": "vehicle_sedan_wreck_ew"
      }
    ]
  }
}
